"bruno-vassari,-body-care,-collagen,-anti-stretch-marks,-body-cream,-day-&-night,-200-ml","Bruno Vassari, Body Care, Collagen, Anti-Stretch Marks, Body Cream, Day & Night, 200 ml",<p>Bruno Vassari - Regular</p>,Bruno Vassari,Body / Body Care,"For Women, Regular, Body Care",TRUE,Title,Default Title,8432666002883,28.26,63.89,2,https://www.mewse.ro/images/produse/bruno-vassari-body-care-anti-stretch-mark-body-cream-day-night-200-ml-1678117982.jpg
"bruno-vassari,-body-care,-essential-oils,-soothing-&-toning,-body-cream,-200-ml","Bruno Vassari, Body Care, Essential Oils, Soothing & Toning, Body Cream, 200 ml",<p>Bruno Vassari - Regular</p>,Bruno Vassari,Body / Body Care,"For Women, Regular, Body Care",TRUE,Title,Default Title,8432666023109,19.33,43.72,3,https://www.mewse.ro/images/produse/bruno-vassari-body-care-essential-oil-soothing-and-toning-body-cream-200-ml-1678118813.png
"bruno-vassari,-senses,-coconut-oil,-hydrating,-body-milk,-morning-&-evening,-400-ml","Bruno Vassari, Senses, Coconut Oil, Hydrating, Body Milk, Morning & Evening, 400 ml",<p>Bruno Vassari - Regular</p>,Bruno Vassari,Body / Body Care,"For Women, Regular, Body Care",TRUE,Title,Default Title,8432666003644,21.60,48.86,3,https://www.mewse.ro/images/produse/bruno-vassari-senses-coconut-oil-hydrating-body-milk-morning-evening-400-ml-1682666992.jpg
"bruno-vassari,-senses,-coconut-oil,-hydrating,-body-milk,-500-ml","Bruno Vassari, Senses, Coconut Oil, Hydrating, Body Milk, 500 ml",<p>Bruno Vassari - Regular</p>,Bruno Vassari,Body / Body Care,"For Women, Regular, Body Care",TRUE,Title,Default Title,8432666023574,22.18,50.17,3,https://www.mewse.ro/images/produse/bruno-vassari-senses-coconut-oil-hydrating-body-milk-500-ml-1680085376.jpg
"bruno-vassari,-kianty-spa,-grape,-anti-cellulite,-body-gel,-2000-ml","Bruno Vassari, Kianty SPA, Grape, Anti-Cellulite, Body Gel, 2000 ml",<p>Bruno Vassari - Regular</p>,Bruno Vassari,Body / Body Care,"For Women, Regular, Body Care",TRUE,Title,Default Title,8432666022829,82.52,245.62,5,https://www.mewse.ro/images/produse/bruno-vassari-kianty-spa-grape-anti-cellulite-body-gel-2000-ml-1683192612.jpg
"bruno-vassari,-white,-brightening,-body-gel,-day-&-night,-100-ml","Bruno Vassari, White, Brightening, Body Gel, Day & Night, 100 ml",<p>Bruno Vassari - Regular</p>,Bruno Vassari,Body / Body Care,"For Women, Regular, Body Care",TRUE,Title,Default Title,8432666003286,25.69,61.72,2,https://www.mewse.ro/images/produse/bruno-vassari-white-brightening-body-gel-day-night-100-ml-1678436015.jpg
"bruno-vassari,-lab-division,-collagen,-peeling,-body-powder,-50-g","Bruno Vassari, Lab Division, Collagen, Peeling, Body Powder, 50 g",<p>Bruno Vassari - Regular</p>,Bruno Vassari,Body / Body Care,"For Women, Regular, Body Care",TRUE,Title,Default Title,8432666023000,22.15,44.98,5,https://www.mewse.ro/images/produse/bruno-vassari-lab-division-collagen-peeling-body-powder-50-g-1682683216.jpg
"bruno-vassari,-the-basics,-natural-plant-extracts,-moisturizing,-soap-bar,-for-face-&-hands,-100-g","Bruno Vassari, The Basics, Natural Plant Extracts, Moisturizing, Soap Bar, For Face & Hands, 100 g",<p>Bruno Vassari - Regular</p>,Bruno Vassari,Body / Shower & Bath,"Unisex, Regular, Shower & Bath",TRUE,Title,Default Title,8432666003156,5.45,12.24,11,https://www.mewse.ro/images/produse/bruno-vassari-the-basics-cleanser-bar-soap-all-over-the-body-100-g-1678356325.jpg
"bruno-vassari,-sun-defense,-panthenol,-sun-protection,-sunscreen-spray,-spf-40,-200-ml","Bruno Vassari, Sun Defense, Panthenol, Sun Protection, Sunscreen Spray, SPF 40, 200 ml",<p>Bruno Vassari - Regular</p>,Bruno Vassari,Body / Sun & Tan,"Unisex, Regular, Sun & Tan",TRUE,Title,Default Title,8432666040816,23.59,53.04,3,https://www.mewse.ro/images/produse/bruno-vassari-sun-defense-sun-protection-sunscreen-spray-spf-40-200-ml-1678281772.jpg
"bruno-vassari,-white,-vitamin-c,-uv-protection,-sunscreen-lotion,-spf-40,-40-g","Bruno Vassari, White, Vitamin C, UV Protection, Sunscreen Lotion, SPF 40, 40 g",<p>Bruno Vassari - Regular</p>,Bruno Vassari,Body / Sun & Tan,"Unisex, Regular, Sun & Tan",TRUE,Title,Default Title,8432666002371,27.93,62.80,1,https://www.mewse.ro/images/produse/bruno-vassari-daily-uv-brightening-lotion-anti-ageing-day-cream-for-face-spf-40-40-g-1678168685.jpg
"bruno-vassari,-kianty-spa,-grape,-anti-ageing,-body-cream-mask,-4000-g","Bruno Vassari, Kianty SPA, Grape, Anti-Ageing, Body Cream Mask, 4000 g",<p>Bruno Vassari - Regular</p>,Bruno Vassari,Body / Body Care,"For Women, Regular, Body Care",TRUE,Title,Default Title,8432666022966,120.65,294.33,3,https://www.mewse.ro/images/produse/bruno-vassari-kianty-spa-grape-anti-ageing-body-cream-mask-4000-g-1683103118.jpg
"bruno-vassari,-kianty-experience,-grape,-anti-ageing,-body-tonic-oil,-500-ml","Bruno Vassari, Kianty Experience, Grape, Anti-Ageing, Body Tonic Oil, 500 ml",<p>Bruno Vassari - Regular</p>,Bruno Vassari,Body / Body Care,"For Women, Regular, Body Care",TRUE,Title,Default Title,8432666022737,53.13,118.06,2,https://www.mewse.ro/images/produse/bruno-vassari-kianty-experience-grape-anti-ageing-body-tonic-oil-500-ml-1680083783.jpg
"bruno-vassari,-kianty-spa,-grape,-anti-ageing,-bath-salt,-25-g","Bruno Vassari, Kianty SPA, Grape, Anti-Ageing, Bath Salt, 25 g",<p>Bruno Vassari - Regular</p>,Bruno Vassari,Body / Shower & Bath,"For Women, Regular, Shower & Bath",TRUE,Title,Default Title,8432666022768,11.37,25.72,13,https://www.mewse.ro/images/produse/bruno-vassari-kianty-spa-grape-anti-ageing-bath-salt-25-g-1678187814.jpg
"bruno-vassari,-kianty-spa,-grape,-brightening,-body-scrub,-350-g","Bruno Vassari, Kianty SPA, Grape, Brightening, Body Scrub, 350 g",<p>Bruno Vassari - Regular</p>,Bruno Vassari,Body / Shower & Bath,"For Women, Regular, Shower & Bath",TRUE,Title,Default Title,8432666022713,30.70,69.44,3,https://www.mewse.ro/images/produse/bruno-vassari-kianty-spa-grape-brightening-body-scrub-350-g-1684484373.png
"bruno-vassari,-lab-biotics,-calming,-body-cream,-for-face-&-body,-100-ml","Bruno Vassari, Lab Biotics, Calming, Body Cream, For Face & Body, 100 ml",<p>Bruno Vassari - Regular</p>,Bruno Vassari,Body / Body Care,"For Women, Regular, Body Care",TRUE,Title,Default Title,8432666003309,33.94,76.76,2,https://www.mewse.ro/images/produse/bruno-vassari-lab-biotics-calming-body-cream-for-face-body-100-ml-1678209255.jpg
"bruno-vassari,-sun-defense,-mattifying-micro-spheres,-uv-protection,-sunscreen-fluid,-50-ml","Bruno Vassari, Sun Defense, Mattifying micro-spheres, UV Protection, Sunscreen Fluid, 50 ml",<p>Bruno Vassari - Regular</p>,Bruno Vassari,Body / Sun & Tan,"Unisex, Regular, Sun & Tan",TRUE,Title,Default Title,8432666040830,22.64,50.92,2,https://www.mewse.ro/images/produse/bruno-vassari-sun-defense-mattifying-micro-spheres-uv-protection-sunscreen-fluid-50-ml-1683470270.jpg
"s.-oliver,-s.-oliver,-deodorant-spray,-for-women,-75-ml","S. Oliver, S. Oliver, Deodorant Spray, For Women, 75 ml",<p>S. Oliver - Regular</p>,S. Oliver,Body / Deodorants & Antiperspirants,"For Women, Regular, Deodorants & Antiperspirants",TRUE,Title,Default Title,4011700879076,5.70,18.00,1,https://www.mewse.ro/images/produse/s-oliver-s-oliver-deodorant-spray-for-women-75-ml-1678191122.png
"s.-oliver,-so-pure,-deodorant-spray,-for-women,-75-ml","S. Oliver, So Pure, Deodorant Spray, For Women, 75 ml",<p>S. Oliver - Regular</p>,S. Oliver,Body / Deodorants & Antiperspirants,"For Women, Regular, Deodorants & Antiperspirants",TRUE,Title,Default Title,4011700886036,4.95,25.00,106,https://www.mewse.ro/images/produse/s-oliver-so-pure-deodorant-spray-for-women-75-ml-1678191292.png
"s.-oliver,-soulmate,-deodorant-spray,-for-women,-75-ml","S. Oliver, Soulmate, Deodorant Spray, For Women, 75 ml",<p>S. Oliver - Regular</p>,S. Oliver,Body / Deodorants & Antiperspirants,"For Women, Regular, Deodorants & Antiperspirants",TRUE,Title,Default Title,4011700863068,8.50,25.00,59,https://www.mewse.ro/images/produse/s-oliver-soulmate-deodorant-spray-for-women-75-ml-1678191940.jpg
"panier-des-sens,-geranium-rosat,-hydrating,-body-lotion,-250-ml","Panier Des Sens, Geranium Rosat, Hydrating, Body Lotion, 250 ml",<p>Panier Des Sens - Regular</p>,Panier Des Sens,Body / Body Care,"For Women, Regular, Body Care",TRUE,Title,Default Title,3760062889742,7.10,14.50,7,https://www.mewse.ro/images/produse/panier-des-sens-geranium-rosat-hydrating-body-lotion-250-ml-1725450852.jpg
"panier-des-sens,-panier-des-sens,-vintage-grape,-soothing,-body-oil,-100-ml","Panier Des Sens, Panier Des Sens, Vintage Grape, Soothing, Body Oil, 100 ml",<p>Panier Des Sens - Regular</p>,Panier Des Sens,Body / Body Care,"Unisex, Regular, Body Care",TRUE,Title,Default Title,5056114102319,8.15,19.28,2,https://www.mewse.ro/images/produse/panier-des-sens-panier-des-sens-vintage-grape-soothing-body-oil-100-ml-1678622912.jpg
"bynacht,-heavy-jet,-shea-butter,-renewing,-foot-balm,-1.5-ml-*sample","Bynacht, Heavy Jet, Shea Butter, Renewing, Foot Balm, 1.5 ml *Sample",<p>Bynacht - Sample</p>,Bynacht,Body / Foot Care,"Unisex, Sample, Foot Care",TRUE,Title,Default Title,0037|66000000000024,1.89,6.00,550,https://www.mewse.ro/images/produse/
"bynacht,-heavy-jet,-shea-butter,-renewing,-foot-balm,-15-ml-*tester","Bynacht, Heavy Jet, Shea Butter, Renewing, Foot Balm, 15 ml *Tester",<p>Bynacht - Tester</p>,Bynacht,Body / Foot Care,"Unisex, Tester, Foot Care",TRUE,Title,Default Title,0037|4260511030446,12.84,79.00,7,https://www.mewse.ro/images/produse/bynacht-heavy-jet-shea-butter-renewing-foot-balm-15-ml-tester-1678726008.jpg
"bynacht,-heavy-jet,-shea-butter,-renewing,-foot-balm,-15-ml","Bynacht, Heavy Jet, Shea Butter, Renewing, Foot Balm, 15 ml",<p>Bynacht - Regular</p>,Bynacht,Body / Foot Care,"Unisex, Regular, Foot Care",TRUE,Title,Default Title,0037|4260511030224,25.69,79.00,12,https://www.mewse.ro/images/produse/bynacht-heavy-jet-shea-butter-renewing-foot-balm-15-ml-1678703886.jpg
"masveri,-sweet-wood,-shower-gel,-200-ml","Masveri, Sweet Wood, Shower Gel, 200 ml",<p>Masveri - Regular</p>,Masveri,Body / Shower & Bath,"For Men, Regular, Shower & Bath",TRUE,Title,Default Title,5906395415168,2.78,22.00,9,https://www.mewse.ro/images/produse/masveri-sweet-wood-shower-gel-200-ml-1680256184.png
"c-thru,-harmony-bliss,-anti-perspirant,-deodorant-spray,-for-women,-75-ml","C-Thru, Harmony Bliss, Anti-Perspirant, Deodorant Spray, For Women, 75 ml",<p>C-Thru - Regular</p>,C-Thru,Body / Deodorants & Antiperspirants,"For Women, Regular, Deodorants & Antiperspirants",TRUE,Title,Default Title,5201314150589,1.64,3.14,546,https://www.mewse.ro/images/produse/c-thru-harmony-bliss-anti-perspirant-deodorant-spray-for-women-75-ml-1680176601.jpg
"c-thru,-harmony-bliss,-body-spray,-75-ml","C-Thru, Harmony Bliss, Body Spray, 75 ml",<p>C-Thru - Regular</p>,C-Thru,Body / Body Care,"For Women, Regular, Body Care",TRUE,Title,Default Title,5201314113478,1.90,7.90,904,https://www.mewse.ro/images/produse/c-thru-harmony-bliss-body-spray-75-ml-1680176488.jpg
"dermacol,-cannabis,-intimate-wash-emulsion,-200-ml","Dermacol, Cannabis, Intimate Wash Emulsion, 200 ml",<p>Dermacol - Regular</p>,Dermacol,Body / Intimate Hygiene,"For Women, Regular, Intimate Hygiene",TRUE,Title,Default Title,8595003120753,3.83,9.75,5,https://www.mewse.ro/images/produse/dermacol-cannabis-intimate-wash-200-ml-1689257413.jpg
"miller-harris,-tea-tonique,-cleansing,-soap-bar,-for-hands,-200-g","Miller Harris, Tea Tonique, Cleansing, Soap Bar, For Hands, 200 g",<p>Miller Harris - Regular</p>,Miller Harris,Body / Shower & Bath,"Unisex, Regular, Shower & Bath",TRUE,Title,Default Title,0037|5051198721258,12.50,25.00,1,https://www.mewse.ro/images/produse/miller-harris-tea-tonique-cleansing-bar-soap-for-hands-200-g-1679835816.jpg
"mums-with-love,-mums-with-love,-cleansing,-bath-oil,-100-ml","Mums With Love, Mums With Love, Cleansing, Bath Oil, 100 ml",<p>Mums With Love - Regular</p>,Mums With Love,Body / Shower & Bath,"For Women, Regular, Shower & Bath",TRUE,Title,Default Title,5707761512890,5.63,12.50,7,https://www.mewse.ro/images/produse/mums-with-love-mums-with-love-cleansing-bath-oil-100-ml-1679915318.jpg
"mums-with-love,-mums-with-love,-shower-gel,-for-all-skin-types,-100-ml","Mums With Love, Mums With Love, Shower Gel, For All Skin Types, 100 ml",<p>Mums With Love - Regular</p>,Mums With Love,Body / Shower & Bath,"For Women, Regular, Shower & Bath",TRUE,Title,Default Title,5707761512876,4.95,11.00,35,https://www.mewse.ro/images/produse/mums-with-love-mums-with-love-shower-gel-for-all-skin-types-100-ml-1679915222.jpg
"mums-with-love,-mums-with-love,-hydrating,-body-lotion,-100-ml","Mums With Love, Mums With Love, Hydrating, Body Lotion, 100 ml",<p>Mums With Love - Regular</p>,Mums With Love,Body / Body Care,"For Women, Regular, Body Care",TRUE,Title,Default Title,5707761512937,5.63,12.50,35,https://www.mewse.ro/images/produse/mums-with-love-mums-with-love-hydrating-body-lotion-100-ml-1679915556.jpg
"mums-with-love,-mums-with-love,-cleansing-and-hydrating,-shower-gel,-for-all-skin-types,-250-ml","Mums With Love, Mums With Love, Cleansing and Hydrating, Shower Gel, For All Skin Types, 250 ml",<p>Mums With Love - Regular</p>,Mums With Love,Body / Shower & Bath,"For Women, Regular, Shower & Bath",TRUE,Title,Default Title,5707761511503,6.30,14.00,66,https://www.mewse.ro/images/produse/mums-with-love-mums-with-love-cleansing-and-hydrating-shower-gel-for-all-skin-types-250-ml-1679928832.jpg
"mums-with-love,-mums-with-love,-hydra-nourishing,-body-oil,-250-ml","Mums With Love, Mums With Love, Hydra-Nourishing, Body Oil, 250 ml",<p>Mums With Love - Regular</p>,Mums With Love,Body / Body Care,"For Women, Regular, Body Care",TRUE,Title,Default Title,5707761511541,7.43,16.50,43,https://www.mewse.ro/images/produse/mums-with-love-mums-with-love-hydra-nourishing-body-oil-250-ml-1679928912.jpg
"mums-with-love,-mums-with-love,-hydra-nourishing,-body-lotion,-250-ml","Mums With Love, Mums With Love, Hydra-Nourishing, Body Lotion, 250 ml",<p>Mums With Love - Regular</p>,Mums With Love,Body / Body Care,"For Women, Regular, Body Care",TRUE,Title,Default Title,5707761511602,8.15,18.10,69,https://www.mewse.ro/images/produse/mums-with-love-mums-with-love-hydra-nourishing-body-lotion-250-ml-1679929194.jpg
"we-are-paradoxx,-detox,-celtic-salt,-exfoliating,-body-scrub,-200-g","We are Paradoxx, Detox, Celtic Salt, Exfoliating, Body Scrub, 200 g",<p>We are Paradoxx - Regular</p>,We are Paradoxx,Body / Shower & Bath,"Unisex, Regular, Shower & Bath",TRUE,Title,Default Title,5060616950156,10.85,40.00,67,https://www.mewse.ro/images/produse/we-are-paradoxx-detox-celtic-salt-exfoliating-body-scrub-200-g-1690276831.png
"la-rive,-disney-frozen,-perfumed,-peach,-deodorant-spray,-for-women,-75-ml","La Rive, Disney Frozen, Perfumed, Peach, Deodorant Spray, For Women, 75 ml",<p>La Rive - Regular</p>,La Rive,Body / Deodorants & Antiperspirants,"For Women, Regular, Deodorants & Antiperspirants",TRUE,Title,Default Title,5901832062318,3.74,10.00,61,https://www.mewse.ro/images/produse/la-rive-disney-frozen-perfumed-peach-deodorant-spray-for-women-75-ml-1690201352.png
"str8,-original,-deodorant-spray,-for-men,-75-ml","Str8, Original, Deodorant Spray, For Men, 75 ml",<p>Str8 - Regular</p>,Str8,Body / Deodorants & Antiperspirants,"For Men, Regular, Deodorants & Antiperspirants",TRUE,Title,Default Title,5201314105923,2.27,5.17,4,https://www.mewse.ro/images/produse/str8-original-scented-spray-for-men-75-ml-1680684599.jpg
"str8,-original,-deodorant-spray,-for-men,-75-ml","Str8, Original, Deodorant Spray, For Men, 75 ml",<p>Str8 - Regular</p>,Str8,Body / Deodorants & Antiperspirants,"For Men, Regular, Deodorants & Antiperspirants",TRUE,Title,Default Title,5201314149774,2.27,5.17,1437,https://www.mewse.ro/images/produse/str8-original-scented-spray-for-men-75-ml-1680684599.jpg
"chanson-d'eau,-chanson-d'eau,-body-spray,-75-ml","Chanson D'Eau, Chanson D'Eau, Body Spray, 75 ml",<p>Chanson D`Eau - Regular</p>,Chanson D`Eau,Body / Body Care,"For Women, Regular, Body Care",TRUE,Title,Default Title,3412242503343,1.46,5.00,11,https://www.mewse.ro/images/produse/chanson-d-eau-chanson-d-eau-body-spray-75-ml-1680505571.jpeg
"chanson-d'eau,-chanson-d'eau,-body-spray,-75-ml","Chanson D'Eau, Chanson D'Eau, Body Spray, 75 ml",<p>Chanson D`Eau - Regular</p>,Chanson D`Eau,Body / Body Care,"For Women, Regular, Body Care",TRUE,Title,Default Title,3614228729871,1.46,5.00,186,https://www.mewse.ro/images/produse/chanson-d-eau-chanson-d-eau-body-spray-75-ml-1680505571.jpeg
"sophie-la-girafe,-la-girafe,-peach,-vanilla,-orange-blossom,-jasmine-&-musk,-fragrance-water,-100-ml","Sophie la Girafe, La Girafe, Peach, Vanilla, Orange Blossom, Jasmine & Musk, Fragrance Water, 100 ml",<p>Sophie la Girafe - Regular</p>,Sophie la Girafe,Body / Body Care,"For Women, Regular, Body Care",TRUE,Title,Default Title,0035|3701392050105,20.00,54.90,75,https://www.mewse.ro/images/produse/sophie-la-girafe-peach-vanilla-orange-blossom-jasmine-musk-fragrance-water-100-ml-1680783812.jpg
"sophie-la-girafe,-la-girafe,-perfumed,-body-spray,-100-ml-*tester","Sophie la Girafe, La Girafe, Perfumed, Body Spray, 100 ml *Tester",<p>Sophie la Girafe - Tester</p>,Sophie la Girafe,Body / Body Care,"None, Tester, Body Care",TRUE,Title,Default Title,0035|3701392054103,9.90,54.90,48,https://www.mewse.ro/images/produse/sophie-la-girafe-eau-de-parfum-100-ml-1680606333.jpg
"kamilica-pharmacy,-kamilica-pharmacy,-anti-cellulite,-day,-body-lotion,-250-ml","Kamilica Pharmacy, Kamilica Pharmacy, Anti-Cellulite, Day, Body Lotion, 250 ml",<p>Kamilica Pharmacy - Regular</p>,Kamilica Pharmacy,Body / Body Care,"For Women, Regular, Body Care",TRUE,Title,Default Title,5319991957060,2.53,22.00,2,https://www.mewse.ro/images/produse/kamilica-pharmacy-kamilica-pharmacy-anti-cellulite-day-body-lotion-250-ml-1680679876.png
"gabriel-ciuzian,-bain-romain,-reparative,-shower-oil,-for-dry-skin,-400-ml-*tester","Gabriel Ciuzian, Bain Romain, Reparative, Shower Oil, For Dry Skin, 400 ml *Tester",<p>Gabriel Ciuzian - Tester</p>,Gabriel Ciuzian,Body / Shower & Bath,"For Women, Tester, Shower & Bath",TRUE,Title,Default Title,99000000007997,3.20,20.92,1,https://www.mewse.ro/images/produse/gabriel-ciuzian-bain-romain-reparative-shower-oil-for-dry-skin-400-ml-tester-1696659240.jpg
"vivian-gray,-sensuous-camelia,-cleansing,-liquid-soap,-350-ml","Vivian Gray, Sensuous Camelia, Cleansing, Liquid Soap, 350 ml",<p>Vivian Gray - Regular</p>,Vivian Gray,Body / Shower & Bath,"For Women, Regular, Shower & Bath",TRUE,Title,Default Title,0043|4250120716305,4.94,7.80,60,https://www.mewse.ro/images/produse/vivian-gray-sensuous-camelia-cleansing-liquid-soap-350-ml-1743164869.png
"vivian-gray,-sensuous-camelia,-cleansing-and-hydrating,-shower-gel,-for-all-skin-types,-350-ml","Vivian Gray, Sensuous Camelia, Cleansing and Hydrating, Shower Gel, For All Skin Types, 350 ml",<p>Vivian Gray - Regular</p>,Vivian Gray,Body / Shower & Bath,"Unisex, Regular, Shower & Bath",TRUE,Title,Default Title,0043|4250120716329,4.94,7.80,60,https://www.mewse.ro/images/produse/vivian-gray-sensuous-camelia-cleansing-and-hydrating-shower-gel-for-all-skin-types-350-ml-1743164965.jpg
"vivian-gray,-delicious-peony,-cleansing,-liquid-soap,-350-ml","Vivian Gray, Delicious Peony, Cleansing, Liquid Soap, 350 ml",<p>Vivian Gray - Regular</p>,Vivian Gray,Body / Shower & Bath,"For Women, Regular, Shower & Bath",TRUE,Title,Default Title,0043|4250120716404,4.94,7.80,60,https://www.mewse.ro/images/produse/vivian-gray-delicious-peony-cleansing-liquid-soap-350-ml-1743165035.jpg
"vivian-gray,-delicious-peony,-cleansing-and-hydrating,-shower-gel,-for-all-skin-types,-350-ml","Vivian Gray, Delicious Peony, Cleansing and Hydrating, Shower Gel, For All Skin Types, 350 ml",<p>Vivian Gray - Regular</p>,Vivian Gray,Body / Shower & Bath,"Unisex, Regular, Shower & Bath",TRUE,Title,Default Title,0043|4250120716428,4.94,7.80,66,https://www.mewse.ro/images/produse/vivian-gray-delicious-peony-cleansing-and-hydrating-shower-gel-for-all-skin-types-350-ml-1743165115.jpg
"set-vivian-gray:-sensual-jasmine,-hydrating,-hand-lotion,-350-ml-+-sensual-jasmine,-cleansing,-liquid-soap,-350-ml","Set Vivian Gray: Sensual Jasmine, Hydrating, Hand Lotion, 350 ml + Sensual Jasmine, Cleansing, Liquid Soap, 350 ml",<p>Vivian Gray - Regular</p>,Vivian Gray,Body / Body Care Sets,"For Women, Regular, Body Care Sets",TRUE,Title,Default Title,0038|4250120716183,8.90,16.50,30,https://www.mewse.ro/images/produse/set-vivian-gray-sensual-jasmine-hydrating-hand-lotion-350-ml-sensual-jasmine-cleansing-liquid-soap-350-ml-1738920738.jpg
"vivian-gray,-wild-orchid,-cleansing,-liquid-soap,-350-ml","Vivian Gray, Wild Orchid, Cleansing, Liquid Soap, 350 ml",<p>Vivian Gray - Regular</p>,Vivian Gray,Body / Shower & Bath,"For Women, Regular, Shower & Bath",TRUE,Title,Default Title,0038|4250120716206,4.28,6.90,94,https://www.mewse.ro/images/produse/vivian-gray-wild-orchid-cleansing-liquid-soap-350-ml-1738913469.jpg
"set-vivian-gray:-wild-orchid,-hydrating,-hand-lotion,-350-ml-+-wild-orchid,-cleansing,-liquid-soap,-350-ml","Set Vivian Gray: Wild Orchid, Hydrating, Hand Lotion, 350 ml + Wild Orchid, Cleansing, Liquid Soap, 350 ml",<p>Vivian Gray - Regular</p>,Vivian Gray,Body / Body Care Sets,"For Women, Regular, Body Care Sets",TRUE,Title,Default Title,0038|4250120716282,8.90,16.50,38,https://www.mewse.ro/images/produse/set-vivian-gray-wild-orchid-hydrating-hand-lotion-350-ml-wild-orchid-cleansing-liquid-soap-350-ml-1738920902.jpg
"set-vivian-gray:-sensual-jasmine,-softening,-shower-gel,-for-all-skin-types,-350-ml-+-sensual-jasmine,-hydrating,-body-lotion,-350-ml","Set Vivian Gray: Sensual Jasmine, Softening, Shower Gel, For All Skin Types, 350 ml + Sensual Jasmine, Hydrating, Body Lotion, 350 ml",<p>Vivian Gray - Regular</p>,Vivian Gray,Body / Body Care Sets,"Unisex, Regular, Body Care Sets",TRUE,Title,Default Title,0038|4250120716190,8.90,16.50,27,https://www.mewse.ro/images/produse/set-vivian-gray-sensual-jasmine-softening-shower-gel-for-all-skin-types-350-ml-sensual-jasmine-hydrating-body-lotion-350-ml-1738920996.jpg
"set-vivian-gray:-wild-orchid,-cleansing-and-hydrating,-shower-gel,-for-all-skin-types,-350-ml-+-wild-orchid,-hydrating,-body-lotion,-350-ml","Set Vivian Gray: Wild Orchid, Cleansing and Hydrating, Shower Gel, For All Skin Types, 350 ml + Wild Orchid, Hydrating, Body Lotion, 350 ml",<p>Vivian Gray - Regular</p>,Vivian Gray,Body / Body Care Sets,"Unisex, Regular, Body Care Sets",TRUE,Title,Default Title,0038|4250120716299,8.90,16.50,39,https://www.mewse.ro/images/produse/set-vivian-gray-wild-orchid-cleansing-and-hydrating-shower-gel-for-all-skin-types-350-ml-wild-orchid-hydrating-hand-lotion-350-ml-1738921089.jpg
"vivian-gray,-wild-orchid,-cleansing-and-hydrating,-shower-gel,-for-all-skin-types,-350-ml","Vivian Gray, Wild Orchid, Cleansing and Hydrating, Shower Gel, For All Skin Types, 350 ml",<p>Vivian Gray - Regular</p>,Vivian Gray,Body / Shower & Bath,"Unisex, Regular, Shower & Bath",TRUE,Title,Default Title,0038|4250120716220,4.28,7.39,223,https://www.mewse.ro/images/produse/vivian-gray-wild-orchid-cleansing-and-hydrating-shower-gel-for-all-skin-types-350-ml-1738913819.jpg
"set-vivian-gray:-sparkling-orange,-cleansing-and-hydrating,-shower-gel,-for-all-skin-types,-350-ml-+-sparkling-orange,-hydrating,-body-lotion,-350-ml","Set Vivian Gray: Sparkling Orange, Cleansing and Hydrating, Shower Gel, For All Skin Types, 350 ml + Sparkling Orange, Hydrating, Body Lotion, 350 ml",<p>Vivian Gray - Regular</p>,Vivian Gray,Body / Body Care Sets,"Unisex, Regular, Body Care Sets",TRUE,Title,Default Title,0038|4250120716091,8.90,16.50,30,https://www.mewse.ro/images/produse/set-vivian-gray-sparkling-orange-cleansing-and-hydrating-shower-gel-for-all-skin-types-350-ml-sparkling-orange-hydrating-body-lotion-350-ml-1738920803.jpg
"vivian-gray,-love-bomb,-hydrating,-hand-cream,-30-ml","Vivian Gray, Love Bomb, Hydrating, Hand Cream, 30 ml",<p>Vivian Gray - Regular</p>,Vivian Gray,Body / Hand & Nail Care,"For Women, Regular, Hand & Nail Care",TRUE,Title,Default Title,0038|4250120710556,1.30,4.00,181,https://www.mewse.ro/images/produse/vivian-gray-love-bomb-hydrating-hand-cream-30-ml-1735805918.jpg
"set-vivian-gray:-brown-crystals-,-hydrating,-body-lotion,-300-ml-+-brown-crystals-,-cleansing,-shower-gel,-for-all-skin-types,-300-ml","Set Vivian Gray: Brown Crystals , Hydrating, Body Lotion, 300 ml + Brown Crystals , Cleansing, Shower Gel, For All Skin Types, 300 ml",<p>Vivian Gray - Regular</p>,Vivian Gray,Body / Body Care Sets,"Unisex, Regular, Body Care Sets",TRUE,Title,Default Title,0043|4250120741970,6.44,13.59,18,https://www.mewse.ro/images/produse/set-vivian-gray-brown-crystals-hydrating-body-lotion-300-ml-brown-crystals-cleansing-shower-gel-for-all-skin-types-300-ml-1735821233.jpg
"set-vivian-gray:-botanicals,-softening,-shower-gel,-for-all-skin-types,-250-ml-+-botanicals,-hydrating,-body-lotion,-250-ml","Set Vivian Gray: Botanicals, Softening, Shower Gel, For All Skin Types, 250 ml + Botanicals, Hydrating, Body Lotion, 250 ml",<p>Vivian Gray - Regular</p>,Vivian Gray,Body / Body Care Sets,"Unisex, Regular, Body Care Sets",TRUE,Title,Default Title,0043|4250120711959,6.67,12.95,90,https://www.mewse.ro/images/produse/set-vivian-gray-botanicals-softening-shower-gel-for-all-skin-types-250-ml-botanicals-hydrating-body-lotion-250-ml-1735378491.jpg
"gemstone-green-set-vivian-gray:-bergamot-&-lemongrass,-cleansing,-liquid-soap,-300-ml-+-bergamot-&-lemongrass,-hydrating,-hand-lotion,-300-ml","Gemstone Green Set Vivian Gray: Bergamot & Lemongrass, Cleansing, Liquid Soap, 300 ml + Bergamot & Lemongrass, Hydrating, Hand Lotion, 300 ml",<p>Vivian Gray - Regular</p>,Vivian Gray,Body / Body Care Sets,"For Women, Regular, Body Care Sets",TRUE,Title,Default Title,0043|4250120735481,7.23,13.95,14,https://www.mewse.ro/images/produse/gemstone-green-set-vivian-gray-bergamot-lemongrass-cleansing-liquid-soap-300-ml-bergamot-lemongrass-hydrating-hand-lotion-300-ml-1735819163.jpg
