"nuxe,-sun-delicious,-sunscreen-cream,-for-face,-spf-30,-50-ml","Nuxe, Sun Delicious, Sunscreen Cream, For Face, SPF 30, 50 ml",<p>Nuxe - Regular</p>,Nuxe,Body / Sun & Tan,"For Women, Regular, Sun & Tan",TRUE,Title,Default Title,3264680005848,9.67,23.27,60,https://www.mewse.ro/images/produse/nuxe-sun-delicious-sunscreen-cream-for-face-spf-30-50-ml-1686825683.png
"nuxe,-reve-de-the,-revitalising,-body-milk,-all-over-the-body,-400-ml","Nuxe, Reve de The, Revitalising, Body Milk, All Over The Body, 400 ml",<p>Nuxe - Regular</p>,Nuxe,Body / Body Care,"For Women, Regular, Body Care",TRUE,Title,Default Title,0035|3264680025105,10.83,28.50,16,https://www.mewse.ro/images/produse/nuxe-reve-de-the-revitalising-body-milk-all-over-the-body-400-ml-0-3264680025105-1674130012.jpg
"nuxe,-huile-prodigieuse-multi-purpose-neroli,-body-oil,-for-face,-body-&-hair,-100-ml","Nuxe, Huile Prodigieuse Multi-Purpose Neroli, Body Oil, For Face, Body & Hair, 100 ml",<p>Nuxe - Regular</p>,Nuxe,Body / Body Care,"For Women, Regular, Body Care",TRUE,Title,Default Title,0035|3264680024993,14.94,39.31,115,https://www.mewse.ro/images/produse/nuxe-huile-prodigieuse-multi-purpose-neroli-body-oil-for-face-body-hair-100-ml--1674458245.jpg
"nuxe,-sun-delicious,-sunscreen-spray,-spf-30,-150-ml","Nuxe, Sun Delicious, Sunscreen Spray, SPF 30, 150 ml",<p>Nuxe - Regular</p>,Nuxe,Body / Sun & Tan,"For Women, Regular, Sun & Tan",TRUE,Title,Default Title,0035|3264680007002,10.00,30.00,1397,https://www.mewse.ro/images/produse/nuxe-sun-delicious-sunscreen-spray-spf-30-150-ml--1674456270.jpg
"nuxe,-reve-de-the,-vegan,-refreshing,-deodorant-roll-on,-for-women,-50-ml","Nuxe, Reve de The, Vegan, Refreshing, Deodorant Roll-On, For Women, 50 ml",<p>Nuxe - Regular</p>,Nuxe,Body / Deodorants & Antiperspirants,"For Women, Regular, Deodorants & Antiperspirants",TRUE,Title,Default Title,0035|3264680021978,4.28,11.25,16,https://www.mewse.ro/images/produse/nuxe-reve-de-miel-vegan-refreshing-deodorant-roll-on-for-women-50-ml--1674129900.jpg
"nuxe,-sun,-after-sun-shampoo,-for-hair-&-body,-100-ml","Nuxe, Sun, After-Sun Shampoo, For Hair & Body, 100 ml",<p>Nuxe - Regular</p>,Nuxe,Body / Sun & Tan,"For Women, Regular, Sun & Tan",TRUE,Title,Default Title,0035|3264680022647,8.36,22.00,1334,https://www.mewse.ro/images/produse/nuxe-sun-after-sun-shampoo-for-hair-body-100-ml-1714470404.jpg
"nuxe,-huile-prodigieuse-or-multi-purpose,-body-oil,-for-face,-body-&-hair,-50-ml-*tester","Nuxe, Huile Prodigieuse Or Multi-Purpose, Body Oil, For Face, Body & Hair, 50 ml *Tester",<p>Nuxe - Tester</p>,Nuxe,Body / Body Care,"For Women, Tester, Body Care",TRUE,Title,Default Title,0035|3264680019326,5.55,22.20,339,https://www.mewse.ro/images/produse/nuxe-huile-prodigieuse-or-multi-purpose-body-oil-for-face-body-hair-50-ml-tester-1714469300.jpg
"nuxe,-huile-prodigieuse-or-multi-purpose,-body-oil,-for-body,-face-&-hair,-10-ml-*miniature","Nuxe, Huile Prodigieuse Or Multi-Purpose, Body Oil, For Body, Face & Hair, 10 ml *Miniature",<p>Nuxe - Miniature</p>,Nuxe,Body / Body Care,"For Women, Miniature, Body Care",TRUE,Title,Default Title,0035|3264680014680,5.62,10.00,205,https://www.mewse.ro/images/produse/nuxe-huile-prodigieuse-or-multi-purpose-body-oil-for-body-face-hair-10-ml-1726572940.jpg
"set-duo,-nuxe,-huile-prodigieuse-multi-purpose-neroli,-body-oil,-for-face,-body-&-hair,-2-pcs,-12-ml-*sample","Set Duo, Nuxe, Huile Prodigieuse Multi-Purpose Neroli, Body Oil, For Face, Body & Hair, 2 pcs, 12 ml *Sample",<p>Nuxe - Sample</p>,Nuxe,Body / Body Care,"For Women, Sample, Body Care",TRUE,Title,Default Title,0035|3264680028441,7.90,0.00,762,https://www.mewse.ro/images/produse/
"nuxe,-reve-de-the,-revitalising,-shower-gel,-for-all-skin-types,-750-ml","Nuxe, Reve de The, Revitalising, Shower Gel, For All Skin Types, 750 ml",<p>Nuxe - Regular</p>,Nuxe,Body / Shower & Bath,"For Women, Regular, Shower & Bath",TRUE,Title,Default Title,0035|3264680038884,10.22,26.90,716,https://www.mewse.ro/images/produse/nuxe-reve-de-the-revitalising-shower-gel-for-all-skin-types-750-ml-1714211703.png
"nuxe,-sun,-moisturizing,-self-tanning-mousse,-for-face-&-body,-150-ml","Nuxe, Sun, Moisturizing, Self-Tanning Mousse, For Face & Body, 150 ml",<p>Nuxe - Regular</p>,Nuxe,Body / Sun & Tan,"For Women, Regular, Sun & Tan",TRUE,Title,Default Title,0035|3264680038914,9.46,24.90,92,https://www.mewse.ro/images/produse/nuxe-sun-moisturizing-self-tanning-mousse-150-ml-1714213206.jpg
"set-duo,-nuxe,-men,-24h-protection,-deodorant-roll-on,-for-men,-2-pcs,-50-ml","Set Duo, Nuxe, Men, 24h Protection, Deodorant Roll-On, For Men, 2 pcs, 50 ml",<p>Nuxe - Regular</p>,Nuxe,Body / Deodorants & Antiperspirants,"For Men, Regular, Deodorants & Antiperspirants",TRUE,Title,Default Title,0035|3264680028922,7.90,20.00,509,https://www.mewse.ro/images/produse/set-duo-nuxe-men-24h-protection-deodorant-roll-on-for-men-2-pcs-50-ml-1714200224.jpg
"nuxe,-men-multi-use,-shower-gel,-all-over-the-body,-for-all-skin-types,-100-ml","Nuxe, Men Multi-Use, Shower Gel, All Over The Body, For All Skin Types, 100 ml",<p>Nuxe - Regular</p>,Nuxe,Body / Shower & Bath,"For Men, Regular, Shower & Bath",TRUE,Title,Default Title,0035|3264680017087,5.90,0.00,730,https://www.mewse.ro/images/produse/nuxe-men-multi-use-shower-gel-all-over-the-body-200-ml-1714200467.jpg
"set-nuxe:-sun,-sun-protection,-tanning-oil,-spf-50,-150-ml-+-sun,-sun-protection,-after-sun-lotion,-100-ml","Set Nuxe: Sun, Sun Protection, Tanning Oil, SPF 50, 150 ml + Sun, Sun Protection, After-Sun Lotion, 100 ml",<p>Nuxe - Regular</p>,Nuxe,Body / Body Care Sets,"For Women, Regular, Body Care Sets",TRUE,Title,Default Title,0035|3264680034961,11.74,30.90,83,https://www.mewse.ro/images/produse/
"nuxe,-huile-prodigieuse-or-florale,-moisturizing,-body-oil,-for-body,-face-&-hair,-50-ml","Nuxe, Huile Prodigieuse Or Florale, Moisturizing, Body Oil, For Body, Face & Hair, 50 ml",<p>Nuxe - Regular</p>,Nuxe,Body / Body Care,"For Women, Regular, Body Care",TRUE,Title,Default Title,0035|3264680038334,11.25,29.60,966,https://www.mewse.ro/images/produse/nuxe-huile-prodigieuse-or-multi-purpose-body-oil-for-body-face-hair-10-ml-1714217525.jpg
"nuxe,-very-rose,-soothing,-shower-gel,-for-all-skin-types,-750-ml","Nuxe, Very Rose, Soothing, Shower Gel, For All Skin Types, 750 ml",<p>Nuxe - Regular</p>,Nuxe,Body / Shower & Bath,"For Women, Regular, Shower & Bath",TRUE,Title,Default Title,0035|3264680038907,13.90,0.00,79,https://www.mewse.ro/images/produse/nuxe-very-rose-soothing-shower-gel-for-all-skin-types-750-ml-1714212835.jpg
"set-nuxe:-sun-melting,-sunscreen-lotion,-spf-30,-150-ml-+-sun,-after-sun-shampoo,-for-hair-&-body,-100-ml","Set Nuxe: Sun Melting, Sunscreen Lotion, SPF 30, 150 ml + Sun, After-Sun Shampoo, For Hair & Body, 100 ml",<p>Nuxe - Regular</p>,Nuxe,Body / Body Care Sets,"For Women, Regular, Body Care Sets",TRUE,Title,Default Title,0035|3264680039584,11.36,29.90,188,https://www.mewse.ro/images/produse/set-nuxe-sun-melting-sunscreen-lotion-spf-30-150-ml-sun-after-sun-shampoo-for-hair-body-100-ml-1714215015.jpg
"set-nuxe:-super-serum-[10],-vegan,-anti-ageing,-day-&-night,-serum,-for-face-&-neck,-30-ml-+-sun,-uv-protection,-sunscreen-cream,-for-face,-spf-50,-50-ml","Set Nuxe: Super Serum [10], Vegan, Anti-Ageing, Day & Night, Serum, For Face & Neck, 30 ml + Sun, UV Protection, Sunscreen Cream, For Face, SPF 50, 50 ml",<p>Nuxe - Regular</p>,Nuxe,Body / Body Care Sets,"For Women, Regular, Body Care Sets",TRUE,Title,Default Title,0035|3264680038235,31.16,82.00,100,https://www.mewse.ro/images/produse/set-nuxe-super-serum-10-vegan-anti-ageing-day-night-serum-for-face-neck-30-ml-sun-melting-sunscreen-cream-for-face-spf-50-50-ml-1714215611.jpg
"travel-set-nuxe:-prodigieux-neroli,-shower-gel,-all-over-the-body,-for-all-skin-types,-30-ml-+-prodigieux-neroli,-eau-de-parfum,-for-women,-15-ml-*miniature-+-reve-de-the,-vegan,-revitalising,-body-scrub,-30-ml-+-huile-prodigieuse-multi-purpose-neroli,-body-oil,-for-face,-body-&-hair,-30-ml","Travel Set Nuxe: Prodigieux Neroli, Shower Gel, All Over The Body, For All Skin Types, 30 ml + Prodigieux Neroli, Eau De Parfum, For Women, 15 ml *Miniature + Reve de The, Vegan, Revitalising, Body Scrub, 30 ml + Huile Prodigieuse Multi-Purpose Neroli, Body Oil, For Face, Body & Hair, 30 ml",<p>Nuxe - Regular</p>,Nuxe,Body / Body Care Sets,"For Women, Regular, Body Care Sets",TRUE,Title,Default Title,0035|3264680034787,22.86,27.10,5,https://www.mewse.ro/images/produse/66162cd700fb01712729303.jpg
"travel-set-nuxe:-prodigieux-neroli,-shower-gel,-all-over-the-body,-for-all-skin-types,-30-ml-+-prodigieux-neroli,-eau-de-parfum,-for-women,-15-ml-*miniature-+-reve-de-the,-vegan,-revitalising,-body-scrub,-30-ml-+-huile-prodigieuse-multi-purpose-neroli,-body-oil,-for-face,-body-&-hair,-30-ml","Travel Set Nuxe: Prodigieux Neroli, Shower Gel, All Over The Body, For All Skin Types, 30 ml + Prodigieux Neroli, Eau De Parfum, For Women, 15 ml *Miniature + Reve de The, Vegan, Revitalising, Body Scrub, 30 ml + Huile Prodigieuse Multi-Purpose Neroli, Body Oil, For Face, Body & Hair, 30 ml",<p>Nuxe - Regular</p>,Nuxe,Body / Body Care Sets,"For Women, Regular, Body Care Sets",TRUE,Title,Default Title,3264680034787,18.45,27.10,70,https://www.mewse.ro/images/produse/66162cd700fb01712729303.jpg
"set-nuxe:-sun,-sun-protection,-tanning-oil,-spf-30,-150-ml-+-sun,-sun-protection,-after-sun-lotion,-100-ml","Set Nuxe: Sun, Sun Protection, Tanning Oil, SPF 30, 150 ml + Sun, Sun Protection, After-Sun Lotion, 100 ml",<p>Nuxe - Regular</p>,Nuxe,Body / Body Care Sets,"For Women, Regular, Body Care Sets",TRUE,Title,Default Title,0035|3264680034954,13.19,34.70,83,https://www.mewse.ro/images/produse/set-nuxe-sun-sun-protection-tanning-oil-spf-30-150-ml-sun-sun-protection-after-sun-lotion-100-ml-1712313976.jpg
"set-nuxe:-sun,-sun-protection,-tanning-oil,-spf-30,-150-ml-+-sun,-sun-protection,-after-sun-lotion,-100-ml","Set Nuxe: Sun, Sun Protection, Tanning Oil, SPF 30, 150 ml + Sun, Sun Protection, After-Sun Lotion, 100 ml",<p>Nuxe - Regular</p>,Nuxe,Body / Body Care Sets,"For Women, Regular, Body Care Sets",TRUE,Title,Default Title,3264680034954,13.00,34.70,312,https://www.mewse.ro/images/produse/set-nuxe-sun-sun-protection-tanning-oil-spf-30-150-ml-sun-sun-protection-after-sun-lotion-100-ml-1712313976.jpg
"hp-clasic-set-nuxe:-huile-prodigieuse-or-multi-purpose,-body-oil,-for-face,-body-&-hair,-50-ml-+-creme-fraiche-de-beaute,-moisturizing,-cream,-for-face,-30-ml-+-reve-de-miel,-honey,-lip-balm,-15-g","Hp Clasic Set Nuxe: Huile Prodigieuse Or Multi-Purpose, Body Oil, For Face, Body & Hair, 50 ml + Creme Fraiche de Beaute, Moisturizing, Cream, For Face, 30 ml + Reve de Miel, Honey, Lip Balm, 15 g",<p>Nuxe - Regular</p>,Nuxe,Body / Body Care Sets,"For Women, Regular, Body Care Sets",TRUE,Title,Default Title,0035|3264680037825,14.90,27.00,152,https://www.mewse.ro/images/produse/hp-clasic-set-nuxe-huile-prodigieuse-or-multi-purpose-body-oil-for-face-body-hair-50-ml-creme-fraiche-de-beaute-moisturizing-cream-for-face-30-ml-reve-de-miel-honey-lip-balm-15-g-1712326047.jpg
"hp-clasic-set-nuxe:-huile-prodigieuse-or-multi-purpose,-body-oil,-for-face,-body-&-hair,-50-ml-+-creme-fraiche-de-beaute,-moisturizing,-cream,-for-face,-30-ml-+-reve-de-miel,-honey,-lip-balm,-15-g","Hp Clasic Set Nuxe: Huile Prodigieuse Or Multi-Purpose, Body Oil, For Face, Body & Hair, 50 ml + Creme Fraiche de Beaute, Moisturizing, Cream, For Face, 30 ml + Reve de Miel, Honey, Lip Balm, 15 g",<p>Nuxe - Regular</p>,Nuxe,Body / Body Care Sets,"For Women, Regular, Body Care Sets",TRUE,Title,Default Title,3264680037825,16.45,27.00,204,https://www.mewse.ro/images/produse/hp-clasic-set-nuxe-huile-prodigieuse-or-multi-purpose-body-oil-for-face-body-hair-50-ml-creme-fraiche-de-beaute-moisturizing-cream-for-face-30-ml-reve-de-miel-honey-lip-balm-15-g-1712326047.jpg
"set-nuxe:-merveillance-expert,-lifting,-cream,-for-face,-50-ml-+-merveillance-lift,-vegan,-lifting,-eye-cream,-15-ml-+-merveillance-lift,-vegan,-lifting,-night,-cream,-for-face,-15-ml","Set Nuxe: Merveillance Expert, Lifting, Cream, For Face, 50 ml + Merveillance Lift, Vegan, Lifting, Eye Cream, 15 ml + Merveillance Lift, Vegan, Lifting, Night, Cream, For Face, 15 ml",<p>Nuxe - Regular</p>,Nuxe,Body / Body Care Sets,"For Women, Regular, Body Care Sets",TRUE,Title,Default Title,3264680037900,27.08,63.00,118,https://www.mewse.ro/images/produse/set-nuxe-merveillance-expert-lifting-cream-for-face-50-ml-merveillance-lift-vegan-lifting-eye-cream-15-ml-merveillance-lift-vegan-lifting-night-cream-for-face-15-ml-1712328894.jpg
"set-duo,-nuxe,-huile-prodigieuse-or-multi-purpose,-body-oil,-all-over-the-body,-2-pcs,-12-ml-*sample","Set Duo, Nuxe, Huile Prodigieuse Or Multi-Purpose, Body Oil, All Over The Body, 2 pcs, 12 ml *Sample",<p>Nuxe - Sample</p>,Nuxe,Body / Body Care,"For Women, Sample, Body Care",TRUE,Title,Default Title,0035|3264680036408,4.67,12.30,343,https://www.mewse.ro/images/produse/
"set-duo,-nuxe,-huile-prodigieuse-or-multi-purpose,-body-oil,-all-over-the-body,-2-pcs,-12-ml-*sample","Set Duo, Nuxe, Huile Prodigieuse Or Multi-Purpose, Body Oil, All Over The Body, 2 pcs, 12 ml *Sample",<p>Nuxe - Sample</p>,Nuxe,Body / Body Care,"For Women, Sample, Body Care",TRUE,Title,Default Title,3264680036408,3.06,12.30,1196,https://www.mewse.ro/images/produse/
"set-nuxe:-sun,-uv-protection,-sunscreen-cream,-for-face,-spf-50,-50-ml-+-sun,-sun-protection,-after-sun-lotion,-50-ml","Set Nuxe: Sun, UV Protection, Sunscreen Cream, For Face, SPF 50, 50 ml + Sun, Sun Protection, After-Sun Lotion, 50 ml",<p>Nuxe - Regular</p>,Nuxe,Body / Body Care Sets,"For Women, Regular, Body Care Sets",TRUE,Title,Default Title,3264680034947,9.46,25.00,376,https://www.mewse.ro/images/produse/set-nuxe-sun-melting-sunscreen-cream-for-face-spf-50-50-ml-sun-sun-protection-after-sun-lotion-50-ml-1712313467.jpg
"collection-set-nuxe:-prodigieux-le-parfum,-eau-de-parfum,-for-women,-15-ml-+-prodigieux,-shower-oil,-all-over-the-body,-for-all-skin-types,-100-ml-+-huile-prodigieuse-or-multi-purpose,-body-oil,-for-face,-body-&-hair,-100-ml-+-prodigieux,-scented-candle,-70-g","Collection Set Nuxe: Prodigieux Le Parfum, Eau De Parfum, For Women, 15 ml + Prodigieux, Shower Oil, All Over The Body, For All Skin Types, 100 ml + Huile Prodigieuse Or Multi-Purpose, Body Oil, For Face, Body & Hair, 100 ml + Prodigieux, Scented Candle, 70 g",<p>Nuxe - Regular</p>,Nuxe,Body / Body Care Sets,"Unisex, Regular, Body Care Sets",TRUE,Title,Default Title,0035|3264680041655,20.38,42.90,5,https://www.mewse.ro/images/produse/660f9c4f119031712299087.jpg
"set-nuxe:-prodigieux-floral,-scented-candle,-70-g-+-prodigieux-floral,-shower-gel,-all-over-the-body,-for-all-skin-types,-100-ml-+-prodigieux-floral-le-parfum,-eau-de-parfum,-for-women,-15-ml-*miniature-+-huile-prodigieuse-multi-purpose-floral,-body-oil,-for-face,-body-&-hair,-100-ml","Set Nuxe: Prodigieux Floral, Scented Candle, 70 g + Prodigieux Floral, Shower Gel, All Over The Body, For All Skin Types, 100 ml + Prodigieux Floral Le Parfum, Eau De Parfum, For Women, 15 ml *Miniature + Huile Prodigieuse Multi-Purpose Floral, Body Oil, For Face, Body & Hair, 100 ml",<p>Nuxe - Regular</p>,Nuxe,Body / Body Care Sets,"Unisex, Regular, Body Care Sets",TRUE,Title,Default Title,0035|3264680041679,20.38,42.90,6,https://www.mewse.ro/images/produse/66100aae1b0a81712327342.jpg
"set-nuxe:-prodigieux-floral,-scented-candle,-70-g-+-prodigieux-floral,-shower-gel,-all-over-the-body,-for-all-skin-types,-100-ml-+-prodigieux-floral-le-parfum,-eau-de-parfum,-for-women,-15-ml-*miniature-+-huile-prodigieuse-multi-purpose-floral,-body-oil,-for-face,-body-&-hair,-100-ml","Set Nuxe: Prodigieux Floral, Scented Candle, 70 g + Prodigieux Floral, Shower Gel, All Over The Body, For All Skin Types, 100 ml + Prodigieux Floral Le Parfum, Eau De Parfum, For Women, 15 ml *Miniature + Huile Prodigieuse Multi-Purpose Floral, Body Oil, For Face, Body & Hair, 100 ml",<p>Nuxe - Regular</p>,Nuxe,Body / Body Care Sets,"Unisex, Regular, Body Care Sets",TRUE,Title,Default Title,3264680037887,22.35,42.90,28,https://www.mewse.ro/images/produse/66100aae1b0a81712327342.jpg
"nuxe,-huile-prodigieuse-multi-purpose-floral,-body-oil,-for-face,-body-&-hair,-100-ml","Nuxe, Huile Prodigieuse Multi-Purpose Floral, Body Oil, For Face, Body & Hair, 100 ml",<p>Nuxe - Regular</p>,Nuxe,Body / Body Care,"For Women, Regular, Body Care",TRUE,Title,Default Title,0035|3264680015946,14.53,38.24,174,https://www.mewse.ro/images/produse/nuxe-huile-prodigieuse-multi-purpose-floral-body-oil-for-face-body-hair-100-ml--1674455228.jpg
"nuxe,-prodigieux,-moisturizing,-body-milk,-200-ml","Nuxe, Prodigieux, Moisturizing, Body Milk, 200 ml",<p>Nuxe - Regular</p>,Nuxe,Body / Body Care,"For Women, Regular, Body Care",TRUE,Title,Default Title,0035|3264680009488,9.12,24.00,41,https://www.mewse.ro/images/produse/nuxe-prodigieux-body-lotion-all-over-the-body-200-ml--1674457969.jpg
"nuxe,-reve-de-miel-cica,-vegan,-hydrating,-hand-cream,-50-ml","Nuxe, Reve de Miel Cica, Vegan, Hydrating, Hand Cream, 50 ml",<p>Nuxe - Regular</p>,Nuxe,Body / Hand & Nail Care,"For Women, Regular, Hand & Nail Care",TRUE,Title,Default Title,0035|3264680026171,6.36,16.73,2,https://www.mewse.ro/images/produse/nuxe-reve-de-miel-cica-vegan-hydrating-hand-cream-50-ml-1687174638.png
"nuxe,-reve-de-miel-cica,-vegan,-hydrating,-hand-cream,-50-ml","Nuxe, Reve de Miel Cica, Vegan, Hydrating, Hand Cream, 50 ml",<p>Nuxe - Regular</p>,Nuxe,Body / Hand & Nail Care,"For Women, Regular, Hand & Nail Care",TRUE,Title,Default Title,3264680026171,6.53,16.73,4,https://www.mewse.ro/images/produse/nuxe-reve-de-miel-cica-vegan-hydrating-hand-cream-50-ml-1687174638.png
"nuxe,-nuxuriance-ultra,-firming,-body-milk,-400-ml","Nuxe, Nuxuriance Ultra, Firming, Body Milk, 400 ml",<p>Nuxe - Regular</p>,Nuxe,Body / Body Care,"None, Regular, Body Care",TRUE,Title,Default Title,0035|3264680034527,18.24,55.00,87,https://www.mewse.ro/images/produse/nuxe-nuxuriance-ultra-firming-body-milk-400-ml-1729500492.jpg
"nuxe,-nuxuriance-ultra,-vitamin-c,-anti-dark-spots,-hand-cream,-75-ml","Nuxe, Nuxuriance Ultra, Vitamin C, Anti-Dark Spots, Hand Cream, 75 ml",<p>Nuxe - Regular</p>,Nuxe,Body / Hand & Nail Care,"For Women, Regular, Hand & Nail Care",TRUE,Title,Default Title,0035|3264680034534,12.75,25.00,106,https://www.mewse.ro/images/produse/nuxe-nuxuriance-ultra-vitamin-c-anti-dark-spots-hand-cream-75-ml-1729501617.jpg
"nuxe,-very-rose,-hydrating,-body-milk,-400-ml","Nuxe, Very Rose, Hydrating, Body Milk, 400 ml",<p>Nuxe - Regular</p>,Nuxe,Body / Body Care,"None, Regular, Body Care",TRUE,Title,Default Title,0035|3264680038891,10.94,36.50,31,https://www.mewse.ro/images/produse/nuxe-very-rose-hydrating-body-milk-400-ml-1729502215.jpg
"nuxe,-sweet-lemon,-cleansing,-shower-gel,-for-all-skin-types,-750-ml","Nuxe, Sweet Lemon, Cleansing, Shower Gel, For All Skin Types, 750 ml",<p>Nuxe - Regular</p>,Nuxe,Body / Shower & Bath,"For Women, Regular, Shower & Bath",TRUE,Title,Default Title,0035|3264680040108,12.13,43.30,779,https://www.mewse.ro/images/produse/nuxe-sweet-lemon-cleansing-shower-gel-for-all-skin-types-750-ml-1729502573.jpg
"nuxe,-sun-refreshing,-after-sun-lotion,-400-ml","Nuxe, Sun Refreshing, After-Sun Lotion, 400 ml",<p>Nuxe - Regular</p>,Nuxe,Body / Sun & Tan,"For Women, Regular, Sun & Tan",TRUE,Title,Default Title,0035|3264680018961,9.86,36.16,860,https://www.mewse.ro/images/produse/nuxe-sun-refreshing-after-sun-lotion-400-ml--1674456371.jpg
"nuxe,-men-multi-use,-shower-gel,-all-over-the-body,-200-ml","Nuxe, Men Multi-Use, Shower Gel, All Over The Body, 200 ml",<p>Nuxe - Regular</p>,Nuxe,Body / Shower & Bath,"For Men, Regular, Shower & Bath",TRUE,Title,Default Title,0035|3264680004964,4.90,12.90,47,https://www.mewse.ro/images/produse/nuxe-men-multi-use-shower-gel-200-ml--1674456130.jpg
"nuxe,-bio-organic,-camelina-oil,-invigorating,-soap-bar,-for-face-&-body,-100-g","Nuxe, Bio Organic, Camelina Oil, Invigorating, Soap Bar, For Face & Body, 100 g",<p>Nuxe - Regular</p>,Nuxe,Body / Shower & Bath,"For Women, Regular, Shower & Bath",TRUE,Title,Default Title,0035|3264680025075,3.19,8.40,24,https://www.mewse.ro/images/produse/nuxe-bio-organic-camelina-oil-invigorating-bar-soap-for-face-body-100-g--1674457686.jpg
"nuxe,-sweet-lime,-hand-cream,-50-ml","Nuxe, Sweet Lime, Hand Cream, 50 ml",<p>Nuxe - Regular</p>,Nuxe,Body / Hand & Nail Care,"For Women, Regular, Hand & Nail Care",TRUE,Title,Default Title,0035|3264680034725,4.37,11.50,210,https://www.mewse.ro/images/produse/nuxe-sweet-lime-hand-cream-50-ml--1674710575.jpg
"nuxe,-huile-prodigieuse-multi-purpose-floral,-body-oil,-for-face,-body-&-hair,-50-ml","Nuxe, Huile Prodigieuse Multi-Purpose Floral, Body Oil, For Face, Body & Hair, 50 ml",<p>Nuxe - Regular</p>,Nuxe,Body / Body Care,"For Women, Regular, Body Care",TRUE,Title,Default Title,0035|3264680024382,9.90,23.00,696,https://www.mewse.ro/images/produse/nuxe-huile-prodigieuse-multi-purpose-floral-body-oil-for-face-body-hair-50-ml--1674455246.jpg
"nuxe,-huile-prodigieuse-multi-purpose-floral,-body-oil,-for-face,-body-&-hair,-50-ml","Nuxe, Huile Prodigieuse Multi-Purpose Floral, Body Oil, For Face, Body & Hair, 50 ml",<p>Nuxe - Regular</p>,Nuxe,Body / Body Care,"For Women, Regular, Body Care",TRUE,Title,Default Title,0043|3264680024382,10.53,23.00,1,https://www.mewse.ro/images/produse/nuxe-huile-prodigieuse-multi-purpose-floral-body-oil-for-face-body-hair-50-ml--1674455246.jpg
"nuxe,-sun,-anti-ageing,-tanning-oil,-spf-50,-150-ml","Nuxe, Sun, Anti-Ageing, Tanning Oil, SPF 50, 150 ml",<p>Nuxe - Regular</p>,Nuxe,Body / Sun & Tan,"For Women, Regular, Sun & Tan",TRUE,Title,Default Title,0035|3264680032608,11.40,30.00,753,https://www.mewse.ro/images/produse/nuxe-sun-anti-ageing-tanning-oil-spf-50-150-ml-1688362020.png
"nuxe,-sun,-anti-ageing,-tanning-oil,-spf-50,-150-ml","Nuxe, Sun, Anti-Ageing, Tanning Oil, SPF 50, 150 ml",<p>Nuxe - Regular</p>,Nuxe,Body / Sun & Tan,"For Women, Regular, Sun & Tan",TRUE,Title,Default Title,3264680032608,10.88,30.00,90,https://www.mewse.ro/images/produse/nuxe-sun-anti-ageing-tanning-oil-spf-50-150-ml-1688362020.png
"nuxe,-sun,-sunscreen-fluid,-for-face,-50-ml","Nuxe, Sun, Sunscreen Fluid, For Face, 50 ml",<p>Nuxe - Regular</p>,Nuxe,Body / Sun & Tan,"For Women, Regular, Sun & Tan",TRUE,Title,Default Title,0035|3264680022166,10.22,26.90,522,https://www.mewse.ro/images/produse/nuxe-sun-sunscreen-fluid-for-face-50-ml--1674456406.jpg
"nuxe,-sun,-sunscreen-fluid,-for-face,-50-ml","Nuxe, Sun, Sunscreen Fluid, For Face, 50 ml",<p>Nuxe - Regular</p>,Nuxe,Body / Sun & Tan,"For Women, Regular, Sun & Tan",TRUE,Title,Default Title,3264680022166,11.94,26.90,88,https://www.mewse.ro/images/produse/nuxe-sun-sunscreen-fluid-for-face-50-ml--1674456406.jpg
"nuxe,-sun-melting,-sunscreen-lotion,-spf-50,-150-ml","Nuxe, Sun Melting, Sunscreen Lotion, SPF 50, 150 ml",<p>Nuxe - Regular</p>,Nuxe,Body / Sun & Tan,"For Women, Regular, Sun & Tan",TRUE,Title,Default Title,0035|3264680028878,9.88,25.99,1613,https://www.mewse.ro/images/produse/nuxe-sun-melting-sunscreen-lotion-spf-50-150-ml--1674710638.jpg
"nuxe,-sun-melting,-sunscreen-lotion,-spf-50,-150-ml","Nuxe, Sun Melting, Sunscreen Lotion, SPF 50, 150 ml",<p>Nuxe - Regular</p>,Nuxe,Body / Sun & Tan,"For Women, Regular, Sun & Tan",TRUE,Title,Default Title,3264680028878,11.27,25.99,16,https://www.mewse.ro/images/produse/nuxe-sun-melting-sunscreen-lotion-spf-50-150-ml--1674710638.jpg
"nuxe,-sun,-uv-protection,-sunscreen-cream,-for-face,-spf-50,-50-ml","Nuxe, Sun, UV Protection, Sunscreen Cream, For Face, SPF 50, 50 ml",<p>Nuxe - Regular</p>,Nuxe,Body / Sun & Tan,"For Women, Regular, Sun & Tan",TRUE,Title,Default Title,0035|3264680006999,13.78,29.00,452,https://www.mewse.ro/images/produse/nuxe-sun-melting-sunscreen-cream-for-face-spf-50-50-ml--1674456251.jpg
"nuxe,-sun,-uv-protection,-sunscreen-cream,-for-face,-spf-50,-50-ml","Nuxe, Sun, UV Protection, Sunscreen Cream, For Face, SPF 50, 50 ml",<p>Nuxe - Regular</p>,Nuxe,Body / Sun & Tan,"For Women, Regular, Sun & Tan",TRUE,Title,Default Title,3264680006999,12.86,29.00,33,https://www.mewse.ro/images/produse/nuxe-sun-melting-sunscreen-cream-for-face-spf-50-50-ml--1674456251.jpg
"set-nuxe:-huile-prodigieuse-or-multi-purpose,-body-oil,-for-body,-face-&-hair,-100-ml-+-huile-prodigieuse-or-multi-purpose,-nourishing,-roll-on-body-oil,-8-ml","Set Nuxe: Huile Prodigieuse Or Multi-Purpose, Body Oil, For Body, Face & Hair, 100 ml + Huile Prodigieuse Or Multi-Purpose, Nourishing, Roll-On Body Oil, 8 ml",<p>Nuxe - Regular</p>,Nuxe,Body / Body Care Sets,"For Women, Regular, Body Care Sets",TRUE,Title,Default Title,0035|3264680036637,14.99,39.10,777,https://www.mewse.ro/images/produse/set-nuxe-huile-prodigieuse-or-multi-purpose-body-oil-for-body-face-hair-100-ml-huile-prodigieuse-or-multi-purpose-nourishing-roll-on-body-oil-8-ml-1726572876.jpg
"nuxe,-prodigieux,-shower-oil,-all-over-the-body,-200-ml","Nuxe, Prodigieux, Shower Oil, All Over The Body, 200 ml",<p>Nuxe - Regular</p>,Nuxe,Body / Shower & Bath,"For Women, Regular, Shower & Bath",TRUE,Title,Default Title,0035|3264680008313,4.72,12.43,71,https://www.mewse.ro/images/produse/nuxe-prodigieux-shower-oil-all-over-the-body-200-ml-1693975173.png
"set-duo,-nuxe,-huile-prodigieuse-multi-purpose-neroli,-hydrating-&-repairing,-body-oil,-for-body,-face-&-hair,-2-pcs,-12-ml-*sample","Set Duo, Nuxe, Huile Prodigieuse Multi-Purpose Neroli, Hydrating & Repairing, Body Oil, For Body, Face & Hair, 2 pcs, 12 ml *Sample",<p>Nuxe - Sample</p>,Nuxe,Body / Body Care,"None, Sample, Body Care",TRUE,Title,Default Title,0035|3264680031182,2.85,7.50,44,https://www.mewse.ro/images/produse/
